{
  "$schema": "http://json-schema.org/draft-07/schema#",
  "$id": "https://guiderail.dev/schemas/pack-v1.json",
  "title": "GuideRail Curriculum Pack",
  "description": "Contract of record for a curriculum pack (spec 003 R1 + amendment 003A). The runtime loader ships a hand-written validator that mirrors this file; tests assert the two agree (ADR-0004).",
  "type": "object",
  "additionalProperties": false,
  "required": [
    "id",
    "version",
    "locale",
    "board",
    "grade_band",
    "tags",
    "allow_domains",
    "allow_keywords",
    "allow_yt_channels",
    "quiz_topics",
    "updated_at"
  ],
  "properties": {
    "id": {
      "type": "string",
      "pattern": "^[a-z0-9][a-z0-9-]{1,62}$",
      "description": "Stable identifier, e.g. cbse-class7."
    },
    "version": {
      "type": "string",
      "pattern": "^\\d+\\.\\d+\\.\\d+$",
      "description": "Pack content version, semver."
    },
    "locale": {
      "type": "string",
      "pattern": "^[a-z]{2}(-[A-Z]{2})?$",
      "description": "BCP-47 locale, e.g. en-IN."
    },
    "board": {
      "type": "string",
      "minLength": 1,
      "maxLength": 64
    },
    "grade_band": {
      "type": "string",
      "minLength": 1,
      "maxLength": 16,
      "description": "Per-class grade band, e.g. \"7\"."
    },
    "tags": {
      "type": "array",
      "minItems": 1,
      "items": { "type": "string", "minLength": 1 },
      "description": "Subject vocabulary; keyword tags and channel subjects draw from here."
    },
    "allow_domains": {
      "type": "array",
      "items": {
        "type": "string",
        "pattern": "^([a-z0-9-]+\\.)+[a-z]{2,}$"
      },
      "description": "Allowlisted domains (plain host strings, no scheme/path)."
    },
    "allow_keywords": {
      "type": "array",
      "items": {
        "type": "object",
        "additionalProperties": false,
        "required": ["term", "tag"],
        "properties": {
          "term": { "type": "string", "minLength": 1, "maxLength": 128 },
          "tag": { "type": "string", "minLength": 1 }
        }
      },
      "description": "Curriculum keywords compiled into the Aho-Corasick automaton at load."
    },
    "allow_yt_channels": {
      "type": "array",
      "items": {
        "type": "object",
        "additionalProperties": false,
        "required": ["channel_id", "handle", "label", "subjects"],
        "properties": {
          "channel_id": {
            "type": "string",
            "pattern": "^UC[A-Za-z0-9_-]{22}$",
            "description": "Authoritative match key (003A A1)."
          },
          "handle": { "type": "string", "minLength": 1 },
          "label": { "type": "string", "minLength": 1 },
          "subjects": {
            "type": "array",
            "items": { "type": "string", "minLength": 1 }
          }
        }
      },
      "description": "Channel-level YouTube allowlist (003A). channel_id must be unique within a pack."
    },
    "quiz_topics": {
      "type": "array",
      "items": { "type": "string", "minLength": 1 },
      "description": "Topics the quiz engine may quiz on (specs 005/012); NOT distraction keywords."
    },
    "updated_at": {
      "type": "string",
      "pattern": "^\\d{4}-\\d{2}-\\d{2}T\\d{2}:\\d{2}:\\d{2}(\\.\\d+)?(Z|[+-]\\d{2}:\\d{2})$",
      "description": "ISO-8601 timestamp the pack was last updated."
    },
    "yt_policy": {
      "type": "object",
      "additionalProperties": false,
      "required": ["shorts", "embeds"],
      "properties": {
        "shorts": { "type": "string", "enum": ["gate", "allow", "inherit"] },
        "embeds": { "type": "string", "enum": ["inherit_parent"] }
      },
      "description": "Optional YouTube policy overrides (003A A2). Defaults applied when absent."
    },
    "signature": {
      "type": "string",
      "description": "Reserved for Phase 3 signed delivery. Never verified in Phase 1."
    }
  }
}
