{
  "id": "homeschool-general",
  "version": "1.0.0",
  "locale": "en-IN",
  "board": "General",
  "grade_band": "7",
  "tags": [
    "math",
    "science",
    "history",
    "geography",
    "civics",
    "english",
    "computer",
    "study"
  ],
  "allow_domains": [
    "khanacademy.org",
    "pw.live",
    "diksha.gov.in",
    "ncert.nic.in",
    "vedantu.com",
    "unacademy.com",
    "doubtnut.com",
    "toppr.com",
    "ck12.org",
    "tiwariacademy.com",
    "learncbse.in",
    "mycbseguide.com",
    "selfstudys.com",
    "byjus.com",
    "meritnation.com",
    "extramarks.com",
    "embibe.com",
    "topperlearning.com",
    "studyrankers.com",
    "nios.ac.in",
    "swayam.gov.in",
    "nptel.ac.in",
    "brilliant.org",
    "geogebra.org",
    "desmos.com",
    "wolframalpha.com",
    "mathsisfun.com",
    "britannica.com",
    "natgeokids.com",
    "ducksters.com",
    "brainpop.com",
    "sciencekids.co.nz",
    "olympiadtester.com",
    "learnohub.com",
    "physicswallah.live",
    "shaalaa.com",
    "aglasem.com",
    "successcds.net",
    "jagranjosh.com",
    "careerpower.in",
    "cuemath.com",
    "splashlearn.com",
    "education.com",
    "ixl.com",
    "khanacademykids.org",
    "storyweaver.org.in",
    "gutenberg.org",
    "oercommons.org",
    "outschool.com",
    "time4learning.com",
    "corestandards.org"
  ],
  "allow_keywords": [
    {
      "term": "algebra",
      "tag": "math"
    },
    {
      "term": "algebraic expression",
      "tag": "math"
    },
    {
      "term": "algebraic identity",
      "tag": "math"
    },
    {
      "term": "integer",
      "tag": "math"
    },
    {
      "term": "fraction",
      "tag": "math"
    },
    {
      "term": "decimal",
      "tag": "math"
    },
    {
      "term": "ratio and proportion",
      "tag": "math"
    },
    {
      "term": "percentage",
      "tag": "math"
    },
    {
      "term": "exponent",
      "tag": "math"
    },
    {
      "term": "exponents and powers",
      "tag": "math"
    },
    {
      "term": "rational number",
      "tag": "math"
    },
    {
      "term": "linear equation",
      "tag": "math"
    },
    {
      "term": "simple equation",
      "tag": "math"
    },
    {
      "term": "coefficient",
      "tag": "math"
    },
    {
      "term": "congruent triangles",
      "tag": "math"
    },
    {
      "term": "quadrilateral",
      "tag": "math"
    },
    {
      "term": "perimeter",
      "tag": "math"
    },
    {
      "term": "surface area",
      "tag": "math"
    },
    {
      "term": "lines and angles",
      "tag": "math"
    },
    {
      "term": "parallel lines",
      "tag": "math"
    },
    {
      "term": "symmetry",
      "tag": "math"
    },
    {
      "term": "geometry",
      "tag": "math"
    },
    {
      "term": "data handling",
      "tag": "math"
    },
    {
      "term": "arithmetic mean",
      "tag": "math"
    },
    {
      "term": "median of data",
      "tag": "math"
    },
    {
      "term": "mode of data",
      "tag": "math"
    },
    {
      "term": "bar graph",
      "tag": "math"
    },
    {
      "term": "probability",
      "tag": "math"
    },
    {
      "term": "polygon",
      "tag": "math"
    },
    {
      "term": "radius",
      "tag": "math"
    },
    {
      "term": "diameter",
      "tag": "math"
    },
    {
      "term": "circumference",
      "tag": "math"
    },
    {
      "term": "number line",
      "tag": "math"
    },
    {
      "term": "prime number",
      "tag": "math"
    },
    {
      "term": "composite number",
      "tag": "math"
    },
    {
      "term": "highest common factor",
      "tag": "math"
    },
    {
      "term": "lowest common multiple",
      "tag": "math"
    },
    {
      "term": "square root",
      "tag": "math"
    },
    {
      "term": "cube root",
      "tag": "math"
    },
    {
      "term": "mensuration",
      "tag": "math"
    },
    {
      "term": "coordinate geometry",
      "tag": "math"
    },
    {
      "term": "profit and loss",
      "tag": "math"
    },
    {
      "term": "simple interest",
      "tag": "math"
    },
    {
      "term": "comparing quantities",
      "tag": "math"
    },
    {
      "term": "natural number",
      "tag": "math"
    },
    {
      "term": "whole number",
      "tag": "math"
    },
    {
      "term": "place value",
      "tag": "math"
    },
    {
      "term": "roman numeral",
      "tag": "math"
    },
    {
      "term": "unitary method",
      "tag": "math"
    },
    {
      "term": "nutrition in plants",
      "tag": "science"
    },
    {
      "term": "photosynthesis",
      "tag": "science"
    },
    {
      "term": "respiration",
      "tag": "science"
    },
    {
      "term": "transportation in animals",
      "tag": "science"
    },
    {
      "term": "excretion",
      "tag": "science"
    },
    {
      "term": "reproduction in plants",
      "tag": "science"
    },
    {
      "term": "heat energy",
      "tag": "science"
    },
    {
      "term": "temperature",
      "tag": "science"
    },
    {
      "term": "thermometer",
      "tag": "science"
    },
    {
      "term": "conduction",
      "tag": "science"
    },
    {
      "term": "convection",
      "tag": "science"
    },
    {
      "term": "radiation",
      "tag": "science"
    },
    {
      "term": "acid",
      "tag": "science"
    },
    {
      "term": "alkali",
      "tag": "science"
    },
    {
      "term": "acids and bases",
      "tag": "science"
    },
    {
      "term": "indicator",
      "tag": "science"
    },
    {
      "term": "neutralisation",
      "tag": "science"
    },
    {
      "term": "physical change",
      "tag": "science"
    },
    {
      "term": "chemical change",
      "tag": "science"
    },
    {
      "term": "rusting of iron",
      "tag": "science"
    },
    {
      "term": "weather and climate",
      "tag": "science"
    },
    {
      "term": "adaptation",
      "tag": "science"
    },
    {
      "term": "wind energy",
      "tag": "science"
    },
    {
      "term": "thunderstorm",
      "tag": "science"
    },
    {
      "term": "cyclone",
      "tag": "science"
    },
    {
      "term": "soil profile",
      "tag": "science"
    },
    {
      "term": "water cycle",
      "tag": "science"
    },
    {
      "term": "forest ecosystem",
      "tag": "science"
    },
    {
      "term": "ecosystem",
      "tag": "science"
    },
    {
      "term": "wastewater treatment",
      "tag": "science"
    },
    {
      "term": "electric current",
      "tag": "science"
    },
    {
      "term": "electric circuit",
      "tag": "science"
    },
    {
      "term": "magnetism",
      "tag": "science"
    },
    {
      "term": "laws of motion",
      "tag": "science"
    },
    {
      "term": "speed and velocity",
      "tag": "science"
    },
    {
      "term": "reflection of light",
      "tag": "science"
    },
    {
      "term": "plane mirror",
      "tag": "science"
    },
    {
      "term": "spherical mirror",
      "tag": "science"
    },
    {
      "term": "lens",
      "tag": "science"
    },
    {
      "term": "chlorophyll",
      "tag": "science"
    },
    {
      "term": "stomata",
      "tag": "science"
    },
    {
      "term": "digestion",
      "tag": "science"
    },
    {
      "term": "circulatory system",
      "tag": "science"
    },
    {
      "term": "nervous system",
      "tag": "science"
    },
    {
      "term": "plant cell",
      "tag": "science"
    },
    {
      "term": "animal cell",
      "tag": "science"
    },
    {
      "term": "human organ",
      "tag": "science"
    },
    {
      "term": "mitochondria",
      "tag": "science"
    },
    {
      "term": "friction",
      "tag": "science"
    },
    {
      "term": "gravitation",
      "tag": "science"
    },
    {
      "term": "kinetic energy",
      "tag": "science"
    },
    {
      "term": "molecule",
      "tag": "science"
    },
    {
      "term": "atom",
      "tag": "science"
    },
    {
      "term": "chemical element",
      "tag": "science"
    },
    {
      "term": "states of matter",
      "tag": "science"
    },
    {
      "term": "food chain",
      "tag": "science"
    },
    {
      "term": "food web",
      "tag": "science"
    },
    {
      "term": "acid rain",
      "tag": "science"
    },
    {
      "term": "boiling point",
      "tag": "science"
    },
    {
      "term": "evaporation and condensation",
      "tag": "science"
    },
    {
      "term": "medieval india",
      "tag": "history"
    },
    {
      "term": "delhi sultanate",
      "tag": "history"
    },
    {
      "term": "mughal empire",
      "tag": "history"
    },
    {
      "term": "dynasty",
      "tag": "history"
    },
    {
      "term": "tribes and nomads",
      "tag": "history"
    },
    {
      "term": "temple architecture",
      "tag": "history"
    },
    {
      "term": "medieval architecture",
      "tag": "history"
    },
    {
      "term": "sultan",
      "tag": "history"
    },
    {
      "term": "emperor",
      "tag": "history"
    },
    {
      "term": "administration",
      "tag": "history"
    },
    {
      "term": "revolution",
      "tag": "history"
    },
    {
      "term": "civilization",
      "tag": "history"
    },
    {
      "term": "ancient civilization",
      "tag": "history"
    },
    {
      "term": "trade route",
      "tag": "history"
    },
    {
      "term": "monument",
      "tag": "history"
    },
    {
      "term": "manuscript",
      "tag": "history"
    },
    {
      "term": "chronicle",
      "tag": "history"
    },
    {
      "term": "coinage",
      "tag": "history"
    },
    {
      "term": "regional culture",
      "tag": "history"
    },
    {
      "term": "bhakti movement",
      "tag": "history"
    },
    {
      "term": "sufi tradition",
      "tag": "history"
    },
    {
      "term": "cavalry",
      "tag": "history"
    },
    {